<?xml version="1.0" encoding="UTF-8"?>
<!DOCTYPE MartConfiguration SYSTEM "MartConfiguration.dtd">
<MartConfiguration description="First Mart Created from version 14 Ensembl Datasources" displayName="Ensembl Mart version 14.1" internalName="ensembl_mart_14_1">
  <Dataset description="For Testing Purposes Only" displayName="Test of a Dataset" internalName="test_dataset">
    <StarBase>test_starbase</StarBase>
    <PrimaryKey>test_primaryKey</PrimaryKey>
    <FilterPage description="For Testing Purposes Only" displayName="Test A Filter Page" internalName="testFilterPage">
      <FilterGroup description="For Testing Purposes Only" displayName="Test A FilterGroup:" internalName="testFilterGroup">
        <FilterSet description="For Testing Purposes Only" displayName="Test of a Filter Set" internalName="testFilterSet" type="radio">
          <FilterSetDescription description="For Testing Purposes Only" displayName="Test of a FilterSetDescription" fieldNameModifier="ensembl" internalName="testFilterSetDescription" tableConstraintModifier="ensemblgene"/>
        </FilterSet>
        <FilterCollection description="For Testing Purposes Only" displayName="Test of a FilterCollection" internalName="testFilterCollection" type="list">
          <UIFilterDescription description="For Testing Purposes Only" displayName="A TEST ID, DOESNT EXIST" fieldName="test_id" internalName="testUIFilterDescription" qualifier="in" tableConstraint="gene_main" type="list"/>
          <UIDSFilterDescription description="For Testing Purposes Only" displayName="A TEST ID, DOESNT EXIST" internalName="testUIDSFilterDescription" objectCode="testObjectCode" type="list"/>
        </FilterCollection>
        <FilterCollection description="For Testing Purposes Only" displayName="A TEST OF FILTER SETS" filterSetName="testFilterSet" internalName="testFilterSetCollection" type="list">
          <UIFilterDescription description="For Testing Purposes Only" displayName="A TEST FIELD MODIFIER" fieldName="syn_exclusive" filterSetReq="field" internalName="filterSetUIFilterDescriptionField" qualifier="in" tableConstraint="gene_main" type="list"/>
          <UIFilterDescription description="For Testing Purposes Only" displayName="A TEST TABLE MODIFIER" fieldName="gene_stable_id_v" filterSetReq="table" internalName="filterSetUIFilterDescriptionTable" qualifier="in" tableConstraint="_dm" type="list"/>
          <UIDSFilterDescription description="For Testing Purposes Only" displayName="A TEST ID, DOESNT EXIST" filterSetReq="table" internalName="filterSetUIDSFilterDescription" objectCode="testObjectCode" type="list"/>
        </FilterCollection>
      </FilterGroup>
    </FilterPage>
    <AttributePage description="For Testing Purposes Only" displayName="Test of an Attribute Page" internalName="testAttributePage">
      <AttributeGroup description="For Testing Purposes Only" displayName="test of an Attribute Group:" internalName="testAttributeGroup">
        <AttributeCollection description="For Testing Purposes Only" displayName="Test of an AttributeCollection:" internalName="testAttributeCollection" maxSelect="1">
          <UIAttributeDescription description="For Testing Purposes Only" displayName="Test of a UIAttributeDescription" fieldName="test_id" homepageURL="http://test.org" internalName="testUIAttributeDescription" linkoutURL="http://test.org?test" maxLength="1" source="test source" tableConstraint="gene_main"/>
          <UIDSAttributeDescription description="For Testing Purposes Only" displayName="Test of a UIDSAttributeDescription" homepageURL="http://test.org" internalName="testUIDSAttributeDescription" linkoutURL="http://test.org?test" objectCode="testObjectCode" source="test source"/>
        </AttributeCollection>
      </AttributeGroup>
    </AttributePage>
  </Dataset>
</MartConfiguration>
